{
  "target_url": "https://monitor-three-olive.vercel.app/login",
  "evaluated_at": "2026-07-10T06:55:10.9825193+08:00",
  "tooling": {
    "opencli": "available and used",
    "chrome_devtools": "available and used"
  },
  "total_score": 4.1,
  "p0_p1_passed": true,
  "verdict": "pass",
  "requirements": [
    {
      "id": "UR-1",
      "priority": "P0",
      "score": 0.75,
      "status": "partial",
      "summary": "已验证持久化竞品列表、添加竞品入口和非破坏性自动采集入口，但创建提交未完整执行，且开关状态同步存在不稳定现象。",
      "evidence_refs": ["E2", "E3", "E4", "E5"]
    },
    {
      "id": "UR-3",
      "priority": "P0",
      "score": 0.85,
      "status": "implemented",
      "summary": "存在真实后端驱动的竞品列表与情报列表、历史多时点情报、持续轮询，以及手动检查后时间戳刷新和结果弹窗。",
      "evidence_refs": ["E4", "E5", "E6", "E8"]
    },
    {
      "id": "UR-4",
      "priority": "P0",
      "score": 1.0,
      "status": "implemented",
      "summary": "收件箱具备概览统计、筛选、类别切换、归档和详情展开等结构化消费能力，基本满足完整要求。",
      "evidence_refs": ["E6", "E7", "E8"]
    },
    {
      "id": "UR-5",
      "priority": "P0",
      "score": 1.0,
      "status": "implemented",
      "summary": "单条情报包含核心信号、影响分析和建议动作，形成完整行动建议链。",
      "evidence_refs": ["E7", "E8"]
    },
    {
      "id": "UR-6",
      "priority": "P1",
      "score": 0.5,
      "status": "partial",
      "summary": "已看到通知邮箱配置、日报文案和反馈入口，但未直接验证真实通知送达历史。",
      "evidence_refs": ["E6", "E9", "E10"]
    }
  ],
  "success_criteria": [
    {
      "id": "SC-1",
      "status": "met",
      "summary": "历史情报、统计数据和轮询接口说明系统可持续产出情报，而非一次性静态报告。"
    },
    {
      "id": "SC-2",
      "status": "met",
      "summary": "展开情报时可见变更、影响分析与建议动作，满足完整决策链。"
    },
    {
      "id": "SC-3",
      "status": "partial",
      "summary": "有“有用/无用”反馈入口，但本次未直接验证其后端落地效果。"
    }
  ],
  "evidence": [
    {
      "id": "E1",
      "type": "page",
      "url": "https://monitor-three-olive.vercel.app/login",
      "summary": "匿名态只显示登录表单和注册链接，核心产品被登录墙阻断。"
    },
    {
      "id": "E2",
      "type": "page",
      "url": "https://monitor-three-olive.vercel.app/competitors",
      "summary": "竞品管理页显示两个已持久化竞品，并为每个竞品提供自动采集、立即检查、编辑、删除操作。"
    },
    {
      "id": "E3",
      "type": "interaction",
      "url": "https://monitor-three-olive.vercel.app/competitors",
      "summary": "点击“+ 添加竞品”后出现包含竞品名称、渠道、URL 和保存按钮的新增表单。"
    },
    {
      "id": "E4",
      "type": "interaction",
      "url": "https://monitor-three-olive.vercel.app/competitors",
      "summary": "对 picpi老师测试 执行立即检查后，出现“暂无重大变化”弹窗，且最后检查时间刷新到 2026/7/10 06:51:18。"
    },
    {
      "id": "E5",
      "type": "network",
      "url": "https://monitor-production-d143.up.railway.app/v1/competitors?user_id=1",
      "summary": "接口重复返回真实竞品数据，包含 auto_monitor_enabled、monitor_interval、last_check_at 和 URL 列表。"
    },
    {
      "id": "E6",
      "type": "page",
      "url": "https://monitor-three-olive.vercel.app/inbox",
      "summary": "收件箱提供概览统计、重要性/渠道筛选、类别筛选，以及有用、无用、归档等条目级动作。"
    },
    {
      "id": "E7",
      "type": "interaction",
      "url": "https://monitor-three-olive.vercel.app/inbox",
      "summary": "展开首条情报后，可见核心信号、影响分析、建议动作，以及竞品、渠道、分类、重要性和时间等元数据。"
    },
    {
      "id": "E8",
      "type": "network",
      "url": "https://monitor-production-d143.up.railway.app/v1/intelligence?user_id=1",
      "summary": "接口结构包含 what_changed、why_it_matters、strategic_intent、action_recommendations、notification_sent_at、is_archived 和 status。"
    },
    {
      "id": "E9",
      "type": "page",
      "url": "https://monitor-three-olive.vercel.app/settings",
      "summary": "设置页显示通知邮箱、默认关注类别，并在点击保存后展示“已保存”。"
    },
    {
      "id": "E10",
      "type": "network",
      "url": "https://monitor-production-d143.up.railway.app/v1/users/me?user_id=1",
      "summary": "用户信息接口返回 email、notification_email 和 default_categories，与设置页相互印证。"
    }
  ],
  "scope_notes": [
    "匿名态只能到登录页；核心 P0/P1 评估基于用户提供登录后的会话完成。",
    "本次未创建重复竞品，也未执行删除等破坏性操作；仅打开新增表单、保存设置、展开情报和触发一次立即检查。",
    "opencli 网络 detail 回放受本机缓存目录 EPERM 影响，因此部分接口证据基于 shape 预览与页面结果联合推断。"
  ]
}
