{
  "target_url": "https://myapp-uyxu.vercel.app/dashboard",
  "evaluated_at": "2026-07-09T13:50:29Z",
  "tooling": {
    "opencli": "用于登录态浏览、交互和网络取证。",
    "chrome_devtools": "用于验证匿名态重定向和受保护 API 行为。"
  },
  "total_score": 4.5,
  "p0_p1_passed": true,
  "verdict": "pass",
  "requirements": [
    {
      "id": "UR-1 Quick setup",
      "priority": "P0",
      "score": 1,
      "status": "implemented",
      "summary": "审计通过真实 UI 创建了 picpi，观察到 POST /api/competitors 返回 201，并确认该竞对已持久化保存。",
      "evidence_refs": ["e2", "e3"]
    },
    {
      "id": "UR-3 Continuous collection and interpretation",
      "priority": "P0",
      "score": 0.75,
      "status": "partial",
      "summary": "在 picpi 上游 demo 发生变化后，产品产出了一条包含时间戳、变化类型、存储内容和 AI 解读的真实快照；但未暴露监控间隔设置，且本次只观察到 1 条变化记录。",
      "evidence_refs": ["e4", "e7", "e8", "e9", "e11"]
    },
    {
      "id": "UR-4 Structured intelligence consumption",
      "priority": "P0",
      "score": 1,
      "status": "implemented",
      "summary": "Dashboard 收集箱包含筛选器、归档状态标签、可选择行，以及跳转到历史页和详情页的入口，且对应快照 API 非空。",
      "evidence_refs": ["e5", "e6", "e7", "e8"]
    },
    {
      "id": "UR-5 Actionable recommendations",
      "priority": "P0",
      "score": 1,
      "status": "implemented",
      "summary": "快照详情 552 在 AI 解读区明确展示了变化、意图、行动和理由。",
      "evidence_refs": ["e10", "e11"]
    },
    {
      "id": "UR-6 Proactive notification + feedback",
      "priority": "P1",
      "score": 0.75,
      "status": "partial",
      "summary": "邮件通知已配置并持久化，但未找到投递证据，也未发现情报质量反馈机制。",
      "evidence_refs": ["e12"]
    }
  ],
  "success_criteria": [
    {
      "id": "recurring_intelligence_without_manual_operation",
      "status": "partial",
      "summary": "在上游 picpi demo timer 引入变化后，产品自动展示出了一条真实 picpi 变化，但仅有单条记录，持续性证据偏弱。"
    },
    {
      "id": "change_intent_recommendation_chain",
      "status": "met",
      "summary": "快照详情 552 包含明确的变化、意图、行动和理由文本。"
    },
    {
      "id": "feedback_mechanism_for_quality_improvement",
      "status": "unmet",
      "summary": "未发现用于评价或纠正情报质量的反馈机制。"
    }
  ],
  "evidence": [
    {
      "id": "e1",
      "type": "network",
      "url": "https://myapp-uyxu.vercel.app/dashboard",
      "summary": "匿名验证时会重定向到 /login，且 /api/auth/me、/api/competitors、/api/snapshots 等受保护 API 返回 401。"
    },
    {
      "id": "e2",
      "type": "interaction",
      "url": "https://myapp-uyxu.vercel.app/dashboard/competitors",
      "summary": "审计通过产品内竞对表单创建了 picpi，随后在列表中确认它已持久化。"
    },
    {
      "id": "e3",
      "type": "network",
      "url": "https://myapp-uyxu.vercel.app/api/competitors",
      "summary": "创建流程发起了 POST /api/competitors 并返回 201，随后 GET /api/competitors 返回 array(2)。"
    },
    {
      "id": "e4",
      "type": "interaction",
      "url": "https://picpi-iota.vercel.app/api/timer/start",
      "summary": "审计触发了间隔 10 秒的 picpi demo timer，以安全地产生上游变化。"
    },
    {
      "id": "e5",
      "type": "page",
      "url": "https://myapp-uyxu.vercel.app/dashboard",
      "summary": "Dashboard 收集箱展示了 1 条 picpi 真实记录，包含时间、标题、重要度和截断后的 AI 摘要。"
    },
    {
      "id": "e6",
      "type": "network",
      "url": "https://myapp-uyxu.vercel.app/api/snapshots?archived=false&page=1&pageSize=100",
      "summary": "Dashboard 快照请求返回 array(1)，字段包括 crawledAt、changeType、summary、importance、archivedAt 和 readAt。"
    },
    {
      "id": "e7",
      "type": "page",
      "url": "https://myapp-uyxu.vercel.app/dashboard/snapshots/8",
      "summary": "picpi 历史页展示了 1 条时间为 2026/7/9 21:45:18 的真实快照记录。"
    },
    {
      "id": "e8",
      "type": "network",
      "url": "https://myapp-uyxu.vercel.app/api/snapshots?competitor_id=8&limit=20",
      "summary": "竞对历史请求返回 array(1)，重新验证后替代了早先的空状态。"
    },
    {
      "id": "e9",
      "type": "page",
      "url": "https://myapp-uyxu.vercel.app/dashboard/settings",
      "summary": "设置页仅显示邮件通知开关，没有暴露监控频率或抓取间隔设置。"
    },
    {
      "id": "e10",
      "type": "page",
      "url": "https://myapp-uyxu.vercel.app/dashboard/snapshots/8/552",
      "summary": "详情页为记录 552 渲染了包含变化、意图、行动和理由的 AI 解读。"
    },
    {
      "id": "e11",
      "type": "network",
      "url": "https://myapp-uyxu.vercel.app/api/snapshots/552",
      "summary": "详情 API 返回了完整存储快照内容，包括 htmlContent、summary、importance 和 readAt。"
    },
    {
      "id": "e12",
      "type": "network",
      "url": "https://myapp-uyxu.vercel.app/api/user/settings",
      "summary": "设置 API 返回了持久化用户设置，其中包括 emailNotifyEnabled=true。"
    }
  ],
  "scope_notes": [
    "匿名态证据受登录保护限制，因此实现评分依赖浏览器中已存在的登录会话。",
    "审计创建了两个低风险夹具：Audit Example 和 picpi，并使用 picpi 进行真实上游变化验证。",
    "审计触发了 picpi demo timer API 以制造真实变化，然后重新验证了 dashboard、竞对历史页和快照详情页。",
    "未执行破坏性操作。没有删除竞对，也没有修改账户级通知设置。"
  ]
}
