{
  "target_url": "https://xierongpan.xyz",
  "evaluated_at": "2026-07-10 07:52:32 +08:00",
  "tooling": {
    "opencli": "available",
    "chrome_devtools": "available"
  },
  "total_score": 3.15,
  "p0_p1_passed": false,
  "verdict": "partial",
  "requirements": [
    {
      "id": "UR-1 Quick setup",
      "priority": "P0",
      "score": 0.85,
      "status": "implemented",
      "summary": "已验证从空项目态创建 Audit Picpi、确认 picpi 目标、启用监控；通知页还能非破坏性关闭并恢复定时巡检。但项目列表 ownProductUrl 仍显示默认值，竞品确认页也未回显既有竞品。",
      "evidence_refs": ["E2", "E3", "E4", "E6"]
    },
    {
      "id": "UR-3 Continuous collection and interpretation",
      "priority": "P0",
      "score": 0.5,
      "status": "partial",
      "summary": "已验证调度配置、手动巡检入口和原始事件落库，总览也出现生成时间与 1 条证据；但抓取停留在排队中，没有形成稳定的持续解释输出。",
      "evidence_refs": ["E4", "E5", "E7", "E8", "E12"]
    },
    {
      "id": "UR-4 Structured intelligence consumption",
      "priority": "P0",
      "score": 0.55,
      "status": "partial",
      "summary": "收件箱结构、优先级筛选、归档开关、原始事件账本和证据抽屉都存在；但真实情报条目没有生成，收件箱工作流未闭环。",
      "evidence_refs": ["E8", "E10"]
    },
    {
      "id": "UR-5 Actionable recommendations",
      "priority": "P0",
      "score": 0.25,
      "status": "claimed",
      "summary": "只有角色化决策视图的壳和空态文案，没有成功产出建议；从原始事件生成情报的接口返回 500。",
      "evidence_refs": ["E7", "E9"]
    },
    {
      "id": "UR-6 Proactive notification + feedback",
      "priority": "P1",
      "score": 1.0,
      "status": "implemented",
      "summary": "通知设置、频率、时区、定时巡检、邮件预览和反馈后台都可见且可保存，已构成主动通知与反馈机制。",
      "evidence_refs": ["E5", "E6", "E11"]
    }
  ],
  "success_criteria": [
    {
      "id": "SC-1 Recurring intelligence without manual operation",
      "status": "partial",
      "summary": "已验证定时巡检配置与手动巡检，但未验证系统能稳定地产出有价值情报。"
    },
    {
      "id": "SC-2 change -> intent -> recommendation chain",
      "status": "unmet",
      "summary": "只落下了原始页面快照，没有成功转成带意图和建议的情报。"
    },
    {
      "id": "SC-3 Feedback mechanism for quality improvement",
      "status": "met",
      "summary": "质量后台存在历史反馈重应用、待验证、已生效和已拒绝等反馈闭环统计。"
    }
  ],
  "evidence": [
    {
      "id": "E1",
      "type": "page",
      "url": "https://xierongpan.xyz/login?next=%2F",
      "summary": "匿名访问被登录墙拦截，登录页提示“请输入账号密码”。"
    },
    {
      "id": "E2",
      "type": "page",
      "url": "https://xierongpan.xyz/projects",
      "summary": "登录后的项目列表为空态，只有新建项目可用，其余监控导航均被禁用。"
    },
    {
      "id": "E3",
      "type": "interaction",
      "url": "https://xierongpan.xyz/projects/project_cbf16b8f-5436-4d89-90d6-6e2d3232a755/setup/scope",
      "summary": "最小夹具 Audit Picpi 创建成功，范围页显示 picpi 已确认且已纳入真实巡检。"
    },
    {
      "id": "E4",
      "type": "network",
      "url": "https://xierongpan.xyz/api/monitoring/enable",
      "summary": "启用监控请求 200，响应包含 notificationPreference、scanSchedule 和 scheduler.event。"
    },
    {
      "id": "E5",
      "type": "page",
      "url": "https://xierongpan.xyz/projects/project_cbf16b8f-5436-4d89-90d6-6e2d3232a755/notifications",
      "summary": "通知页提供收件邮箱、时区、频率、低优先级开关、定时巡检和邮件预览。"
    },
    {
      "id": "E6",
      "type": "interaction",
      "url": "https://xierongpan.xyz/api/notifications/settings",
      "summary": "实测可将定时巡检从已启用切到已停用，再恢复为已启用；两次保存均返回 200。"
    },
    {
      "id": "E7",
      "type": "page",
      "url": "https://xierongpan.xyz/projects/project_cbf16b8f-5436-4d89-90d6-6e2d3232a755/overview",
      "summary": "手动巡检并显式刷新后，总览显示生成于 2026-07-10 07:48，证据基础变为 1 条。"
    },
    {
      "id": "E8",
      "type": "page",
      "url": "https://xierongpan.xyz/projects/project_cbf16b8f-5436-4d89-90d6-6e2d3232a755/raw-events",
      "summary": "原始事件页保留 baseline_initial_markdown_snapshot，并能展开证据抽屉查看来源页、摘录和变化说明。"
    },
    {
      "id": "E9",
      "type": "network",
      "url": "https://xierongpan.xyz/api/raw-events/reevaluate",
      "summary": "点击“应生成情报”后返回 500，页面状态提示 Invalid re-evaluation request。"
    },
    {
      "id": "E10",
      "type": "page",
      "url": "https://xierongpan.xyz/projects/project_cbf16b8f-5436-4d89-90d6-6e2d3232a755/inbox",
      "summary": "收件箱有优先级筛选和归档开关，但没有任何情报条目。"
    },
    {
      "id": "E11",
      "type": "page",
      "url": "https://xierongpan.xyz/projects/project_cbf16b8f-5436-4d89-90d6-6e2d3232a755/quality",
      "summary": "质量后台提供反馈统计、重评估入口和已验证偏好区域，构成反馈闭环骨架。"
    },
    {
      "id": "E12",
      "type": "screenshot",
      "url": "https://picpi-iota.vercel.app/",
      "summary": "Chrome DevTools 快照和截图验证被监控目标页包含功能、定价、更新日志、招聘与 API/Webhook 内容，与原始事件摘录一致。"
    }
  ],
  "scope_notes": [
    "核心产品功能在登录态内完成审计；匿名态仅验证了登录墙。",
    "本次创建的最小测试夹具为 Audit Picpi，监控目标为 https://picpi-iota.vercel.app/。",
    "为验证非破坏性停用路径，曾短暂关闭并恢复定时巡检，最终状态已恢复为已启用。",
    "已在浏览器上下文触发 picpi timer API，但在观察窗口内没有产出结构化情报卡片。",
    "opencli 的网络缓存权限异常导致部分请求体无法展开，因此对 reevaluate 失败原因的判断只依据 500 状态和页面提示。"
  ]
}
