{
  "target_url": "https://joey-workshop.vercel.app/",
  "evaluated_at": "2026-07-10T00:55:31.2984398+08:00",
  "tooling": {
    "opencli": "ok",
    "chrome_devtools": "ok"
  },
  "total_score": 4.3,
  "p0_p1_passed": false,
  "verdict": "partial",
  "requirements": [
    {
      "id": "UR-1",
      "priority": "P0",
      "score": 1.0,
      "status": "implemented",
      "summary": "Setup flow is clear and target lifecycle includes non-destructive stop/pause with history retained.",
      "evidence_refs": ["E1", "E2"]
    },
    {
      "id": "UR-3",
      "priority": "P0",
      "score": 0.9,
      "status": "implemented",
      "summary": "Recurring collection cadence and interpreted intelligence are evidenced; the empty run-log surface appears to be an observability bug rather than a failure of the collection loop, but it slightly reduces completeness.",
      "evidence_refs": ["E1", "E3", "E5"]
    },
    {
      "id": "UR-4",
      "priority": "P0",
      "score": 1.0,
      "status": "implemented",
      "summary": "A structured inbox exists with filters, detail view, archive control, and target scoping.",
      "evidence_refs": ["E1", "E4"]
    },
    {
      "id": "UR-5",
      "priority": "P0",
      "score": 1.0,
      "status": "implemented",
      "summary": "Detail view contains the full change -> intent -> recommendation chain with evidence payloads.",
      "evidence_refs": ["E4", "E6"]
    },
    {
      "id": "UR-6",
      "priority": "P1",
      "score": 0.4,
      "status": "partial",
      "summary": "Email notification configuration is visible, but no delivery history or verified proactive send evidence was found; no feedback mechanism was found.",
      "evidence_refs": ["E1", "E2"]
    }
  ],
  "success_criteria": [
    {
      "id": "SC-1",
      "status": "met",
      "summary": "Recurring intelligence is evidenced by cadences on target cards and multiple formal intelligence items with 2026-07-09 timestamps."
    },
    {
      "id": "SC-2",
      "status": "met",
      "summary": "The selected intelligence detail includes change summary, impact assessment, and recommended action."
    },
    {
      "id": "SC-3",
      "status": "unmet",
      "summary": "No explicit feedback mechanism for improving intelligence quality was found."
    }
  ],
  "evidence": [
    {
      "id": "E1",
      "type": "page",
      "url": "https://joey-workshop.vercel.app/",
      "summary": "Dashboard shows target cards with cadences, email labels, stop/pause actions, inbox filters, and archive flow."
    },
    {
      "id": "E2",
      "type": "interaction",
      "url": "https://joey-workshop.vercel.app/",
      "summary": "Add-competitor dialog exposes target name, cadence, page type, URL, importance strategy, and email notification toggle."
    },
    {
      "id": "E3",
      "type": "network",
      "url": "https://joey-workshop.vercel.app/api/intelligence?status=formal",
      "summary": "Formal intelligence list returns items with createdAt timestamps, importance, confidence, and recommendedAction."
    },
    {
      "id": "E4",
      "type": "network",
      "url": "https://joey-workshop.vercel.app/api/intelligence/a5544b49-7e40-46bf-a629-3e07bef33107",
      "summary": "Intelligence detail returns impactAssessment, recommendedAction, sourceUrl, previousContent, and currentContent."
    },
    {
      "id": "E5",
      "type": "page",
      "url": "https://joey-workshop.vercel.app/",
      "summary": "Monitor log page displays 0 recent records and an empty-state message."
    },
    {
      "id": "E6",
      "type": "screenshot",
      "url": "D:\\github\\lensmor-demo\\tmp\\joey-workshop-audit.png",
      "summary": "Full-page screenshot captured during the audit."
    }
  ],
  "scope_notes": [
    "Used both opencli browser and chrome-devtools as required by the skill.",
    "Created and logged in with audit account audit_20260710 in the DevTools context; no targets were created, archived, or deleted during the audit.",
    "Reused existing in-product targets and intelligence data; deletion side effects on historical access were not directly tested."
  ]
}
