{
  "target_url": "https://ai-workshop-peach.vercel.app",
  "evaluated_at": "2026-07-10T07:21:13.7111232+08:00",
  "tooling": {
    "opencli": "1.8.4",
    "chrome_devtools": "available via MCP"
  },
  "total_score": 4.25,
  "p0_p1_passed": true,
  "verdict": "pass",
  "requirements": [
    {
      "id": "UR-1 Quick setup",
      "priority": "P0",
      "score": 0.85,
      "status": "implemented",
      "summary": "通过站内导航可以到达完整的新建任务表单，包含项目名称、自有产品文档、竞品 URL、Cron、Feishu Webhook 和任务状态。已有任务卡片提供编辑、立即执行、查看监控和非破坏式停用开关。缺口在于 fresh session 下直接访问 /projects 可能返回 404，且不同会话之间的数据可见性不一致。",
      "evidence_refs": [
        "E1",
        "E2",
        "E3",
        "E10",
        "E11"
      ]
    },
    {
      "id": "UR-3 Continuous collection and interpretation",
      "priority": "P0",
      "score": 0.95,
      "status": "implemented",
      "summary": "仪表盘显示过去 24 小时执行 188 次、重大变更 89 条。projects API 暴露 cron 调度；reports API 持续返回带时间戳的 CHANGED、NO_CHANGE、ERROR_CRAWL 记录，以及 HTML、Markdown 报告链接。少量 crawl 失败影响稳定性，但持续采集和解释闭环已被明确验证。",
      "evidence_refs": [
        "E3",
        "E4",
        "E7"
      ]
    },
    {
      "id": "UR-4 Structured intelligence consumption",
      "priority": "P0",
      "score": 0.55,
      "status": "partial",
      "summary": "opencli 会话下可以看到结构化执行列表和详情页，但未验证到筛选、归档等组织能力。更关键的是，DevTools 会话下的任务管理页和任务监控页会显示空态，即使 API 已返回真实数据，因此核心消费面存在跨会话不一致问题。",
      "evidence_refs": [
        "E5",
        "E6",
        "E7",
        "E9",
        "E10"
      ]
    },
    {
      "id": "UR-5 Actionable recommendations",
      "priority": "P0",
      "score": 1.0,
      "status": "implemented",
      "summary": "报告 192 明确拆分出变化摘要、战略意图和行动建议，形成完整的 change -> intent -> recommendation 链路。",
      "evidence_refs": [
        "E6"
      ]
    },
    {
      "id": "UR-6 Proactive notification + feedback",
      "priority": "P1",
      "score": 0.9,
      "status": "implemented",
      "summary": "任务配置中存在 Feishu Webhook 字段；reports API 中多条变更记录的 push_status 为 PUSHED，可作为主动推送的强证据。报告详情页还提供“有帮助/没帮助”和评语输入框。由于未直接验证飞书下游是否真实送达，因此略微扣分。",
      "evidence_refs": [
        "E1",
        "E3",
        "E6",
        "E7"
      ]
    }
  ],
  "success_criteria": [
    {
      "id": "SC-1",
      "status": "met",
      "summary": "Cron 调度、持续生成的报告时间戳，以及过去 24 小时执行次数，说明在已有任务前提下，系统可以在无需手动操作的情况下持续产出情报。"
    },
    {
      "id": "SC-2",
      "status": "met",
      "summary": "报告 192 同时包含变化、意图和建议三段内容，满足完整决策链路要求。"
    },
    {
      "id": "SC-3",
      "status": "met",
      "summary": "报告详情页提供正负反馈和自由评语，可用于持续改进情报质量。"
    }
  ],
  "evidence": [
    {
      "id": "E1",
      "type": "page",
      "url": "https://ai-workshop-peach.vercel.app/projects/new",
      "summary": "通过站内导航打开新建任务表单，字段覆盖项目名称、自有产品文档、竞品 URL 行、Cron、Feishu Webhook 和任务状态。截图：docs/钟滨松/devtools-project-new-form.png"
    },
    {
      "id": "E2",
      "type": "page",
      "url": "https://ai-workshop-peach.vercel.app/projects",
      "summary": "在 opencli 会话中，任务管理页展示多个已有任务，每个任务都带有停用、立即执行、编辑和查看监控操作。"
    },
    {
      "id": "E3",
      "type": "network",
      "url": "https://ai-workshop-peach.vercel.app/api/projects",
      "summary": "projects API 返回项目对象，包含 competitor_urls、cron、feishu_webhook、is_active、next_run_at 等字段。本地留档：docs/钟滨松/api-projects-1.network-response"
    },
    {
      "id": "E4",
      "type": "page",
      "url": "https://ai-workshop-peach.vercel.app/cockpit",
      "summary": "仪表盘展示 5 个任务、过去 24 小时 188 次执行、89 条重大变更，以及最近重大变更卡片。"
    },
    {
      "id": "E5",
      "type": "page",
      "url": "https://ai-workshop-peach.vercel.app/monitoring",
      "summary": "在 opencli 会话中，监控页展示结构化执行表格，包含任务、状态、变化摘要、评分、执行时间和详情入口。截图：docs/钟滨松/opencli-monitoring-list.png"
    },
    {
      "id": "E6",
      "type": "page",
      "url": "https://ai-workshop-peach.vercel.app/monitoring/192",
      "summary": "通过站内导航进入报告 192 后，详情页展示内嵌 HTML 报告，包含竞品概述、变化摘要、战略意图、行动建议、证据 diff 和反馈控件。截图：docs/钟滨松/opencli-report-192.png"
    },
    {
      "id": "E7",
      "type": "network",
      "url": "https://ai-workshop-peach.vercel.app/api/reports",
      "summary": "reports API 返回大量 CHANGED、NO_CHANGE、ERROR_CRAWL 记录，包含 push_status 以及 html_report_path、md_table_path。本地留档：docs/钟滨松/api-reports.network-response"
    },
    {
      "id": "E8",
      "type": "interaction",
      "url": "https://ai-workshop-peach.vercel.app/projects",
      "summary": "任务卡片暴露停用开关，因此停止监控并不依赖破坏式删除。"
    },
    {
      "id": "E9",
      "type": "screenshot",
      "url": "https://ai-workshop-peach.vercel.app/monitoring",
      "summary": "在 DevTools 会话中，监控页显示空态；但 reports API 和 opencli 会话都能看到真实记录。截图：docs/钟滨松/devtools-monitoring-empty.png"
    },
    {
      "id": "E10",
      "type": "screenshot",
      "url": "https://ai-workshop-peach.vercel.app/projects",
      "summary": "在 DevTools 会话中，projects 页显示空态；但 projects API 和 opencli 会话都能看到已有任务。截图：docs/钟滨松/devtools-projects-empty.png"
    },
    {
      "id": "E11",
      "type": "page",
      "url": "https://ai-workshop-peach.vercel.app/monitoring/192",
      "summary": "fresh session 下直接访问 /cockpit、/projects、/monitoring/192 可能落到 Vercel 404；而经站内 SPA 导航又可正常渲染，说明路由直达存在缺陷。截图：docs/钟滨松/opencli-monitoring-192.png；快照：docs/钟滨松/devtools-cockpit-snapshot.txt"
    }
  ],
  "scope_notes": [
    "本次未遇到登录墙，审计以匿名态完成。",
    "本次没有创建、编辑或删除任何任务，只打开了新建任务表单并检查现有数据和现有报告。",
    "通知送达的判断基于 Feishu Webhook 配置和 reports API 中的 push_status，未直接验证飞书下游是否真实收件。",
    "opencli 与 Chrome DevTools 之间存在明显的数据可见性差异。评分优先依据已验证的产品表面和 API 证据，同时将该差异记为缺口。",
    "部分中文内容在本地终端输出中曾出现编码伪影，但结构字段、状态值、URL 和时间戳均可稳定判读。"
  ]
}
